{
 "schema_version": "1.0",
 "id": "ORG-092",
 "asserted": false,
 "identity": {
  "name": "Bolshevik TV",
  "status": "Марксистский видеоканал (описание канала пустое, отнесён к резерву).",
  "legal_form": "Левый видеоканал"
 },
 "channels": {
  "site": "https://www.youtube.com/channel/UC1HepLDiU2vTOrmgb3YJuJg"
 },
 "positions": [],
 "activities": [],
 "cooperation": {},
 "visibility": {
  "level": "public",
  "contacts_public": false
 },
 "meta": {
  "list_section": "Русскоязычные YouTube-каналы",
  "page_status": "Наблюдаем",
  "page_category": "D",
  "date_checked": "17-10-2026",
  "source": "thinkred.ru/cooperation (снимок 2026-10-17), карточка №92",
  "notes": "Совпадает по теме или формату: Левый видеоканал · Россия. Проверено: yt-dlp, 1920 подписчиков, 11 октября 2026."
 }
}
