{
 "schema_version": "1.0",
 "id": "ORG-021",
 "asserted": false,
 "identity": {
  "name": "Коммунистическая партия Кубы",
  "status": "Правящая партия Кубы, основана Фиделем Кастро; лидер — Мигель Диас-Канель.",
  "legal_form": "Правящая партия"
 },
 "channels": {
  "site": "https://ru.wikipedia.org/wiki/Коммунистическая_партия_Кубы"
 },
 "positions": [],
 "activities": [],
 "cooperation": {},
 "visibility": {
  "level": "public",
  "contacts_public": false
 },
 "meta": {
  "list_section": "Международные партии и форматы",
  "page_status": "Наблюдаем",
  "page_category": "D",
  "date_checked": "17-10-2026",
  "source": "thinkred.ru/cooperation (снимок 2026-10-17), карточка №21",
  "notes": "Кубинскому опыту у нас посвящены статья и разбор. Наблюдаем."
 }
}
