{
 "schema_version": "1.0",
 "id": "ORG-161",
 "asserted": false,
 "identity": {
  "name": "Красный университет Фонда рабочей академии",
  "status": "Бесплатное очное и дистанционное обучение марксизму-ленинизму: цикл лекций и семинаров по Гегелю, Марксу, Ленину (философия, политэкономия, научный социализм), конспект лекций и экзамен. Второй лектор",
  "legal_form": "Фонд рабочей академии (Фонд содействия обучению рабочих), СПб"
 },
 "channels": {
  "site": "https://fra-mos.ru/krasnyj-universitet/"
 },
 "positions": [],
 "activities": [],
 "cooperation": {},
 "visibility": {
  "level": "public",
  "contacts_public": false
 },
 "meta": {
  "list_section": "Образовательные проекты и школы",
  "page_status": "Наблюдаем",
  "page_category": "D",
  "date_checked": "17-10-2026",
  "source": "thinkred.ru/cooperation (снимок 2026-10-17), карточка №161",
  "notes": "Совпадает по теме или формату: Первоисточники, лекции+семинары, очно и дистанционно. Проверено: HTTP 200; title: «КРАСНЫЙ УНИВЕРСИТЕТ - ФОНД РАБОЧЕЙ АКАДЕМИИ»; расписание 2025/26. frafond.ru — 200"
 }
}
