{
 "schema_version": "1.0",
 "id": "ORG-181",
 "asserted": false,
 "identity": {
  "name": "Объединённая коммунистическая партия (ОКП)",
  "status": "№ 4995559232 номер заявления в Роскомнадзор., Наша партия - ОКП - была образована 15 марта 2014 года на Учредительном съезде в Москве. В работе съезда...",
  "legal_form": "Несистемная коммунистическая партия, основана в 2014 году"
 },
 "channels": {
  "site": "https://vk.com/okp_rf"
 },
 "positions": [],
 "activities": [],
 "cooperation": {},
 "visibility": {
  "level": "public",
  "contacts_public": false
 },
 "meta": {
  "list_section": "ВКонтакте: сообщества",
  "page_status": "Наблюдаем",
  "page_category": "D",
  "date_checked": "17-10-2026",
  "source": "thinkred.ru/cooperation (снимок 2026-10-17), карточка №181",
  "notes": "Совпадает по теме или формату: партия. Проверено: HTTP 200; &lt;title&gt; = «ОБЪЕДИНЁННАЯ КОММУНИСТИЧЕСКАЯ ПАРТИЯ | ОКП | № 4995559232 номер заявления в Роскомнадзор"
 }
}
