{
 "schema_version": "1.0",
 "id": "ORG-088",
 "asserted": false,
 "identity": {
  "name": "Марксистская Тенденция",
  "status": "Рассказы о политике, истории и экономике с марксистских позиций.",
  "legal_form": "Марксистский канал"
 },
 "channels": {
  "site": "https://www.youtube.com/channel/UCgIYvbz5T9bHzXLnXzjojpA"
 },
 "positions": [],
 "activities": [],
 "cooperation": {},
 "visibility": {
  "level": "public",
  "contacts_public": false
 },
 "meta": {
  "list_section": "Русскоязычные YouTube-каналы",
  "page_status": "Наблюдаем",
  "page_category": "D",
  "date_checked": "17-10-2026",
  "source": "thinkred.ru/cooperation (снимок 2026-10-17), карточка №88",
  "notes": "Совпадает по теме или формату: Марксистский канал · Россия. Проверено: yt-dlp, 1830 подписчиков, 11 октября 2026."
 }
}
