{
 "schema_version": "1.0",
 "id": "ORG-096",
 "asserted": false,
 "identity": {
  "name": "Философский Штурм",
  "status": "Видеоканал сайта philosophystorm.org: философия, логика, гносеология, марксистская методология.",
  "legal_form": "Философский видеоканал"
 },
 "channels": {
  "site": "https://www.youtube.com/channel/UCIetuC-DetV8B-lW8vG9Ssg"
 },
 "positions": [],
 "activities": [],
 "cooperation": {},
 "visibility": {
  "level": "public",
  "contacts_public": false
 },
 "meta": {
  "list_section": "Русскоязычные YouTube-каналы",
  "page_status": "Наблюдаем",
  "page_category": "D",
  "date_checked": "17-10-2026",
  "source": "thinkred.ru/cooperation (снимок 2026-10-17), карточка №96",
  "notes": "Совпадает по теме или формату: Философский видеоканал · Россия. Проверено: yt-dlp, 14500 подписчиков, 11 октября 2026."
 }
}
