{
 "schema_version": "1.0",
 "id": "ORG-201",
 "asserted": false,
 "identity": {
  "name": "Партия коммунистов Республики Молдова (ПКРМ)",
  "status": "Партия коммунистов Республики Молдова: новости, документы, пленумы райкомов. На XI съезде (2026) сменилось руководство (впервые за 30 лет).",
  "legal_form": "Парламентская коммунистическая партия"
 },
 "channels": {
  "site": "https://pcrm.md/"
 },
 "positions": [],
 "activities": [],
 "cooperation": {},
 "visibility": {
  "level": "public",
  "contacts_public": false
 },
 "meta": {
  "list_section": "Страны СНГ: организации и проекты",
  "page_status": "Наблюдаем",
  "page_category": "D",
  "date_checked": "17-10-2026",
  "source": "thinkred.ru/cooperation (снимок 2026-10-17), карточка №201",
  "notes": "Совпадает по теме или формату: марксистско-ленинская самоидентификация, но метод парламентский Проверено: GET https://pcrm.md/ -&gt; HTTP 200 (68893 байта) (проверено 2026-10-11)"
 }
}
