{
 "schema_version": "1.0",
 "id": "ORG-048",
 "asserted": false,
 "identity": {
  "name": "Политштурм / Politsturm",
  "status": "Канал марксистско-ленинского медиа-проекта Politsturm.com: политэкономия, классовая борьба, история коммунистического движения, популярные объяснения марксизма.",
  "legal_form": "марксистско-ленинское медиа / организация"
 },
 "channels": {
  "site": "https://www.youtube.com/channel/UCdWGGzM6fX5xVq1gDNZev0A"
 },
 "positions": [],
 "activities": [],
 "cooperation": {},
 "visibility": {
  "level": "public",
  "contacts_public": false
 },
 "meta": {
  "list_section": "Русскоязычные YouTube-каналы",
  "page_status": "Наблюдаем",
  "page_category": "D",
  "date_checked": "17-10-2026",
  "source": "thinkred.ru/cooperation (снимок 2026-10-17), карточка №48",
  "notes": "Совпадает по теме или формату: Прямой соратник по просвещению: такие же объяснения марксизма-ленинизма простым языком.. Проверено: GET канала → HTTP 200, &lt;title&gt;«Politsturm - YouTube»&gt;; yt-dlp: подписчиков 79500, описание «Канал организации politsturm.com». Сайт описывает себя как"
 }
}
