{
 "schema_version": "1.0",
 "id": "ORG-098",
 "asserted": false,
 "identity": {
  "name": "Ленинградское интернет-тв",
  "status": "Проект Дианы Романовой: лекции и аналитика по обществу, истории, культуре.",
  "legal_form": "Образовательное/медиа"
 },
 "channels": {
  "site": "https://www.youtube.com/channel/UCtYm_PM6vQVfRdSgBqg6ksQ"
 },
 "positions": [],
 "activities": [],
 "cooperation": {},
 "visibility": {
  "level": "public",
  "contacts_public": false
 },
 "meta": {
  "list_section": "Русскоязычные YouTube-каналы",
  "page_status": "Наблюдаем",
  "page_category": "D",
  "date_checked": "17-10-2026",
  "source": "thinkred.ru/cooperation (снимок 2026-10-17), карточка №98",
  "notes": "Совпадает по теме или формату: Образовательное/медиа · Россия. Проверено: yt-dlp, 115000 подписчиков, 11 октября 2026."
 }
}
